dialogue,anger,disgust,fear,joy,neutral,sadness,surprise
Why is it that we often remember the feeling a place gives us more than its physical details?,0.010907061398029327,0.017117056995630264,0.005917214788496494,0.0056669581681489944,0.7100028395652771,0.004083078354597092,0.24630577862262726
What's your personal mantra that helps you stay grounded in challenging times?,0.013073372654616833,0.0040084789507091045,0.015533758327364922,0.0051868571899831295,0.9186672568321228,0.004415752831846476,0.039114613085985184
Ever notice how a genuine compliment can brighten your entire day?,0.026782145723700523,0.008124444633722305,0.0023907541763037443,0.10394828021526337,0.12546087801456451,0.003952517174184322,0.7293409705162048
"Why do you think we're drawn to certain books, movies, or music during specific life phases?",0.022717397660017014,0.01021015178412199,0.006386334076523781,0.003825990715995431,0.7485199570655823,0.0032463145907968283,0.2050938457250595
Life's a journey; what's the most memorable road trip or travel experience you've had?,0.007550222333520651,0.0035935225896537304,0.006714922841638327,0.0663270577788353,0.5060874223709106,0.0037490567192435265,0.4059777557849884
"What's your favorite way to celebrate personal growth and accomplishments, big or small?",0.0352855920791626,0.017984438687562943,0.0034984250087291002,0.12128666788339615,0.6987844109535217,0.004379026126116514,0.11878137290477753
Why is it that we often underestimate the impact of consistency in our habits?,0.028862152248620987,0.020107820630073547,0.008833128027617931,0.001352529739961028,0.6618837714195251,0.00810941495001316,0.2708512246608734
Have you ever had a moment when a friend's support helped you through a tough time?,0.010824157856404781,0.0427551306784153,0.09066715091466904,0.3155759274959564,0.3369854688644409,0.09118398278951645,0.11200820654630661
What's your favorite way to express gratitude for the positive aspects of your life?,0.03900473937392235,0.012464556843042374,0.0017566308379173279,0.2177117019891739,0.5953417420387268,0.004610820673406124,0.12910985946655273
Isn't it incredible how a well-timed quote or saying can provide comfort and inspiration?,0.007776951417326927,0.00814666599035263,0.007334493100643158,0.020773183554410934,0.08315486460924149,0.0033345466945320368,0.869479238986969
"Why do we sometimes find joy in the process of creating, regardless of the end result?",0.007520823273807764,0.009175782091915607,0.0005087170866318047,0.8983117938041687,0.06865521520376205,0.00725868996232748,0.008568844757974148
Life's too short for self-doubt; what's one thing you appreciate about yourself?,0.005693243350833654,0.006894158199429512,0.024152716621756554,0.012836317531764507,0.9131434559822083,0.006262505427002907,0.03101750835776329
What's your favorite way to balance productivity and relaxation in your daily routine?,0.023718373849987984,0.008678941987454891,0.0048207445070147514,0.044964034110307693,0.8171876668930054,0.004789332393556833,0.09584084153175354
"Ever had a day when you felt like everything aligned perfectly, like pieces of a puzzle?",0.015159482136368752,0.00547456368803978,0.01869872398674488,0.04715198278427124,0.6435389518737793,0.0037392624653875828,0.2662370204925537
Why is it that we often remember the moments of laughter shared with loved ones?,0.014509784989058971,0.005905612371861935,0.002063180785626173,0.1639430671930313,0.6100726127624512,0.003458586521446705,0.20004712045192719
What's your go-to method for overcoming challenges and setbacks?,0.01487449649721384,0.005142391659319401,0.02663317695260048,0.004763246979564428,0.8812286257743835,0.005540797486901283,0.06181721016764641
Isn't it amazing how a genuine smile can create a positive ripple effect around you?,0.006318294443190098,0.0027898780535906553,0.0023210912477225065,0.020645247772336006,0.02533719688653946,0.0015353579074144363,0.9410529136657715
"Why do you think we often find comfort in routines, even when spontaneity is exciting?",0.018304580822587013,0.0059059695340693,0.0028105424717068672,0.06065642461180687,0.8012456893920898,0.00396458525210619,0.10711218416690826
Life's a series of connections; what's one friendship that has significantly shaped you?,0.005803760606795549,0.0027559080626815557,0.006427845451980829,0.01353814173489809,0.7944937348365784,0.003555428935214877,0.17342515289783478
What's your favorite way to savor the present moment and appreciate the now?,0.012062173336744308,0.02703753672540188,0.0017011298332363367,0.23782508075237274,0.6918333172798157,0.007001516409218311,0.02253929153084755
Why is it that we sometimes overlook the beauty in simplicity and routine?,0.05505739524960518,0.06732739508152008,0.005393111612647772,0.004069548100233078,0.7299538850784302,0.014229541644454002,0.12396915256977081
Ever had a moment when a piece of advice or insight completely shifted your perspective?,0.013012940064072609,0.023994233459234238,0.0495135560631752,0.010538540780544281,0.08445074409246445,0.002176296664401889,0.8163137435913086
What's your favorite way to foster a sense of community in your life?,0.017351418733596802,0.013108455576002598,0.0050382292829453945,0.08586395531892776,0.7603553533554077,0.0052941469475626945,0.11298844963312149
Isn't it fascinating how a single photograph can encapsulate a wealth of emotions and memories?,0.008893824182450771,0.012684652581810951,0.0055062477476894855,0.011499863117933273,0.21798142790794373,0.0030763226095587015,0.7403576374053955
Why do we often find strength in vulnerability and sharing our authentic selves?,0.0071860929019749165,0.007250478491187096,0.09112194180488586,0.006741130258888006,0.8505585193634033,0.010751880705356598,0.02638995833694935
"What's your favorite way to infuse creativity into your daily life, no matter how small?",0.02482280321419239,0.012956956401467323,0.004457117523998022,0.0432506762444973,0.8084456324577332,0.00401001563295722,0.10205674171447754
Life's a blend of highs and lows; what's one lesson you've learned during a challenging time?,0.004360059276223183,0.004233724437654018,0.006601851899176836,0.006051625590771437,0.9372991323471069,0.009875217452645302,0.03157835453748703
What's your favorite way to celebrate the accomplishments of those around you?,0.035952527076005936,0.021373111754655838,0.002734245965257287,0.14949893951416016,0.680249810218811,0.004914033226668835,0.10527728497982025
"Why is it that we often find solace in revisiting familiar places, books, or movies?",0.007181885186582804,0.012675960548222065,0.004715991206467152,0.3054729104042053,0.6150234937667847,0.02690373733639717,0.02802605740725994
Have you ever had a day when you felt like the universe was sending you positive vibes?,0.006232143379747868,0.00891728512942791,0.0023804453667253256,0.4197068214416504,0.4901715815067291,0.00820575188845396,0.06438600271940231
What's your personal recipe for overcoming self-doubt and boosting confidence?,0.009924844838678837,0.009985759854316711,0.30464258790016174,0.015300795435905457,0.6172229051589966,0.00966839212924242,0.03325473144650459
Life's a canvas; what's one dream or goal you're excited to paint in the next chapter?,0.011638248339295387,0.004525907337665558,0.005269479006528854,0.02239038050174713,0.9014714956283569,0.003881357377395034,0.05082310736179352
Why do you think we often remember moments of laughter and joy more vividly than others?,0.01068228017538786,0.005584328435361385,0.005798736587166786,0.015237306244671345,0.7798218131065369,0.003202448831871152,0.17967304587364197
"Ever had a conversation that felt like a turning point, shaping the course of your life?",0.017164599150419235,0.023956259712576866,0.10343681275844574,0.014337928965687752,0.32317981123924255,0.0064459023997187614,0.5114787220954895
What's your favorite way to embrace the unknown and navigate uncertainty?,0.010515102185308933,0.006133576389402151,0.4525245130062103,0.06001346558332443,0.4268803596496582,0.005770726595073938,0.038162291049957275
Isn't it incredible how a shared experience can create bonds that last a lifetime?,0.009124116972088814,0.0064422148279845715,0.005118985660374165,0.006796603556722403,0.029810378327965736,0.0017943547572940588,0.9409133791923523
What's your go-to method for sparking creativity when you feel stuck or uninspired?,0.059783704578876495,0.028585446998476982,0.02237270213663578,0.001772598596289754,0.17439121007919312,0.6958242654800415,0.01727011613547802
Life's too short for regrets; what's something you're ready to pursue without hesitation?,0.007890739478170872,0.003696525702252984,0.9317725896835327,0.0013301970902830362,0.04432035610079765,0.0070440140552818775,0.003945655655115843
Why do you think we often find comfort in the sound of familiar voices and laughter?,0.0056286039762198925,0.00996953435242176,0.007891776040196419,0.04701853170990944,0.8857859373092651,0.006652438081800938,0.0370531789958477
Do you ever feel like your intuition is whispering a message you can't quite decipher?,0.01454246137291193,0.015677541494369507,0.8230698704719543,0.004559924826025963,0.07114506512880325,0.007978957146406174,0.06302624195814133
Life's a journey; what's one lesson you've learned from an unexpected source?,0.005631918087601662,0.001986142247915268,0.009021421894431114,0.02893928252160549,0.2317076474428177,0.004512771964073181,0.7182007431983948
What's your favorite way to celebrate the accomplishments of the people you care about?,0.038100410252809525,0.02787412703037262,0.0026214569807052612,0.15056751668453217,0.6961745023727417,0.0047407737001776695,0.07992121577262878
Ever notice how a simple act of kindness can create a ripple effect in your day?,0.024537276476621628,0.011589430272579193,0.006581492722034454,0.047586530447006226,0.33534103631973267,0.002584710717201233,0.5717794895172119
Why do you think we find solace in revisiting cherished memories during challenging times?,0.007695817854255438,0.006018035113811493,0.00466252863407135,0.3627955913543701,0.5637521743774414,0.03695637360215187,0.018119463697075844
"Life's like a puzzle; sometimes, you need to take a step back to see the bigger picture.",0.008175668306648731,0.005415446124970913,0.01861102133989334,0.004713444504886866,0.9180972576141357,0.010558117181062698,0.034428976476192474
What's your favorite way to stay grounded when life gets chaotic?,0.21177992224693298,0.01396713126450777,0.12034129351377487,0.020522015169262886,0.5432078838348389,0.0298513974994421,0.0603303387761116
Have you ever experienced a moment when a decision felt like destiny in the making?,0.010872336104512215,0.009190807119011879,0.2272753268480301,0.0550779327750206,0.1125398501753807,0.0056459675543010235,0.5793977975845337
Why is it that we often remember the emotions associated with a place more than its details?,0.021224865689873695,0.020444117486476898,0.007393221836537123,0.0016360172303393483,0.6414399743080139,0.004571361932903528,0.3032905161380768
Do you ever feel like your dreams are sending you messages that linger in your waking hours?,0.020664703100919724,0.06335184723138809,0.1492629200220108,0.002959403907880187,0.7013375163078308,0.029713544994592667,0.03271009773015976
What's your go-to method for practicing self-compassion on difficult days?,0.019053500145673752,0.010191638953983784,0.029855389147996902,0.004194706212729216,0.8777209520339966,0.009605290368199348,0.04937855899333954
"Life's a dance; sometimes, you lead, and other times, you follow the rhythm of the universe.",0.009307017549872398,0.015882613137364388,0.005331972613930702,0.007335876580327749,0.9449602961540222,0.005056910216808319,0.012125340290367603
Why do you think certain scents have the power to transport us back to specific moments?,0.03261955454945564,0.020155780017375946,0.005194876808673143,0.0024367261212319136,0.7279253005981445,0.003403864800930023,0.20826396346092224
Ever notice how a shared laugh with a friend can turn a regular day into an extraordinary one?,0.006600481458008289,0.002752861473709345,0.0036729013081640005,0.018217211589217186,0.036335915327072144,0.001605709083378315,0.9308148622512817
Isn't it amazing how a well-timed piece of advice can change the trajectory of your day?,0.007914034649729729,0.004578119143843651,0.002850241493433714,0.005302781239151955,0.017382698133587837,0.0015604435466229916,0.9604116678237915
"Why do we often find comfort in the sound of rain, like nature's lullaby?",0.0030614943243563175,0.0123501718044281,0.007576917763799429,0.06792790442705154,0.8373672962188721,0.058115165680646896,0.01360111590474844
What's your personal anthem that encourages you to embrace your uniqueness?,0.009758159518241882,0.005532247945666313,0.007331324275583029,0.027692638337612152,0.8804664611816406,0.006762494798749685,0.06245678290724754
Life's too short for self-doubt; what's one accomplishment you're proud of?,0.007034065667539835,0.009953750297427177,0.08193840831518173,0.007121930830180645,0.8599754571914673,0.007139533758163452,0.026836927980184555
"Have you ever experienced a ""Eureka!"" moment that sparked a new idea or perspective?",0.009179631248116493,0.003513480070978403,0.09304959326982498,0.042183492332696915,0.04028190299868584,0.0019177306676283479,0.8098741769790649
Why do we sometimes find inspiration in the most unexpected places or people?,0.0071139768697321415,0.0015257175546139479,0.006386926397681236,0.006537662353366613,0.05833275243639946,0.0019348686328157783,0.9181681275367737
What's your favorite way to celebrate the small victories along your journey?,0.03820757567882538,0.015755729749798775,0.0029798627365380526,0.14902684092521667,0.6759714484214783,0.004619599785655737,0.11343896389007568
Isn't it incredible how a genuine smile can create a positive ripple effect around you?,0.010187646374106407,0.004589705262333155,0.004892145283520222,0.02332318015396595,0.050733521580696106,0.0014946440933272243,0.9047791361808777
Why do you think we remember the feeling a place gives us more than its physical details?,0.012332642450928688,0.014812302775681019,0.006023943889886141,0.004360427614301443,0.704584538936615,0.003558048978447914,0.2543281018733978
What's your favorite way to infuse creativity into your daily routine?,0.02645304426550865,0.009921918623149395,0.004738898482173681,0.04433393105864525,0.7588086128234863,0.0043585761450231075,0.15138497948646545
Why is it that we often remember moments of laughter and joy more vividly than others?,0.01058762427419424,0.006943987682461739,0.0052755456417799,0.04020284488797188,0.8119699954986572,0.0037603965029120445,0.1212596744298935
Isn't it amazing how a genuine compliment can brighten your entire day?,0.005875431001186371,0.0028684167191386223,0.0017353236908093095,0.009866170585155487,0.01623818650841713,0.001360500929877162,0.962056040763855
Why is it that we often remember the laughter shared with friends more than the jokes themselves?,0.016238855198025703,0.013260338455438614,0.0026584146544337273,0.015931416302919388,0.5529605746269226,0.003411536803469062,0.395538866519928
"Life's an adventure; sometimes, you need to embrace the detours and unexpected moments.",0.004420717246830463,0.0040550148114562035,0.007104989606887102,0.16132812201976776,0.7574981451034546,0.010481812991201878,0.055111151188611984
"Why do we find comfort in revisiting familiar places and routines, even when change is exciting?",0.009742895141243935,0.023147420957684517,0.012036526575684547,0.01716787926852703,0.9108855128288269,0.009648589417338371,0.017371125519275665
Why is it that we often overlook the beauty in simplicity and routine?,0.04762687906622887,0.049260981380939484,0.00470117898657918,0.004934125579893589,0.7332424521446228,0.013691620901226997,0.1465427279472351
What's your favorite way to overcome self-doubt and boost your confidence?,0.013443432748317719,0.010296326130628586,0.07774209976196289,0.04558984190225601,0.7878000140190125,0.0056075602769851685,0.05952073261141777
What's your favorite way to practice self-care during hectic times?,0.03165798634290695,0.009116984903812408,0.011634424328804016,0.029248785227537155,0.8346360325813293,0.008015795610845089,0.07568999379873276
Life's a tapestry woven with experiences; what's a moment you'd frame and hang on your wall?,0.007802960928529501,0.009063051082193851,0.00834536924958229,0.014219465665519238,0.8354543447494507,0.004913417622447014,0.12020134180784225
Why do you think we often find inspiration in the resilience of others?,0.017757203429937363,0.006447643972933292,0.007597494404762983,0.003898054827004671,0.7509396076202393,0.0031060983892530203,0.21025381982326508
Ever notice how a spontaneous road trip can clear the mind and refresh the spirit?,0.012600023299455643,0.004417480435222387,0.005043273326009512,0.07390201091766357,0.14390212297439575,0.0030153775587677956,0.7571197152137756
What's your go-to comfort food that feels like a warm hug from the inside?,0.0060103158466517925,0.009255235083401203,0.0026898421347141266,0.250218003988266,0.6956261396408081,0.005044339224696159,0.031156135722994804
Isn't it amazing how a well-timed compliment can turn a day around?,0.00641289260238409,0.0034619448706507683,0.0021731157321482897,0.007047875318676233,0.01456857193261385,0.0014776973985135555,0.9648579359054565
Why do you think we sometimes feel the need to apologize for taking time for ourselves?,0.024088842794299126,0.10773786902427673,0.00806395523250103,0.004610597621649504,0.5015487670898438,0.3054676055908203,0.04848240315914154
Life's a constant ebb and flow; what's one thing you're embracing in this current chapter?,0.010982714593410492,0.013482744805514812,0.014192352071404457,0.0037984917871654034,0.9065157175064087,0.010457743890583515,0.04057026281952858
What's your favorite way to contribute to the positive energy of a space?,0.024505842477083206,0.016275987029075623,0.003068220801651478,0.08943719416856766,0.7532202005386353,0.0040025487542152405,0.1094900593161583
Have you ever had a moment when a quote perfectly captured what you were feeling?,0.024905815720558167,0.05121077224612236,0.0072912899777293205,0.03051110915839672,0.3876083493232727,0.00507794925943017,0.49339476227760315
Why is it that we often remember the feeling a book gives us more than its plot?,0.015511631034314632,0.019619600847363472,0.0037861112505197525,0.006029995623975992,0.7059154510498047,0.0038387791719287634,0.24529848992824554
What's your personal mantra that guides you through challenging moments?,0.012674680911004543,0.00400837417691946,0.014687660150229931,0.00538586126640439,0.9142378568649292,0.0027251376304775476,0.04628026485443115
Ever had a day when you felt like you were living in a technicolor dream?,0.00936915073543787,0.009718832559883595,0.23611977696418762,0.008348598144948483,0.08739962428808212,0.005956178065389395,0.6430878639221191
Life's a story; what's a plot twist you didn't see coming but wouldn't change?,0.02527792565524578,0.014476700685918331,0.011446929536759853,0.007406419608741999,0.4853544533252716,0.008047409355640411,0.4479902386665344
Why do you think we find comfort in the nostalgia of old photographs?,0.0047857509925961494,0.014037794433534145,0.0032735783606767654,0.013032359071075916,0.9289970993995667,0.01348661258816719,0.02238677255809307
What's your favorite way to turn a setback into a setup for a comeback?,0.015528476797044277,0.007551130838692188,0.010221858508884907,0.06875314563512802,0.7792327404022217,0.01021153200417757,0.1085011437535286
Isn't it incredible how a piece of music can evoke a flood of emotions and memories?,0.011469707824289799,0.010464511811733246,0.007800318766385317,0.005874595604836941,0.02962062694132328,0.001843421719968319,0.9329267740249634
Why do we sometimes hesitate to acknowledge the progress we've made?,0.003782462328672409,0.002701817313209176,0.9543929100036621,0.0011391022708266973,0.029049038887023926,0.0029559535905718803,0.005978746339678764
What's your go-to method for finding joy in the midst of a busy day?,0.013189101591706276,0.00430581858381629,0.0044562434777617455,0.5591578483581543,0.3278803825378418,0.02548794448375702,0.06552265584468842
Life's a garden; what's one lesson you've learned from nurturing your own?,0.008176091127097607,0.005024563521146774,0.0019468391546979547,0.005599436815828085,0.9416019320487976,0.0034371751826256514,0.034214019775390625
What's your favorite way to embrace vulnerability and authenticity?,0.011940008960664272,0.012731327675282955,0.03769037872552872,0.03305390104651451,0.852537214756012,0.004432853311300278,0.04761427640914917
Ever notice how a deep breath can be a reset button for the mind?,0.043052852153778076,0.2702533006668091,0.07721207290887833,0.0027604245115071535,0.31434255838394165,0.019813453778624535,0.27256539463996887
Why is it that we often remember the kindness of strangers more than other interactions?,0.01799507439136505,0.03922386094927788,0.003601775271818042,0.0037988563999533653,0.7727011442184448,0.003386592958122492,0.15929268300533295
What's your favorite way to infuse adventure into your everyday routine?,0.02154533378779888,0.008779650554060936,0.00450339587405324,0.04715001583099365,0.7757923007011414,0.004078669007867575,0.1381506323814392
Life's too short for self-doubt; what's a strength you've discovered within yourself?,0.006008324678987265,0.011874346993863583,0.19409099221229553,0.005277459975332022,0.7500807642936707,0.012288167141377926,0.020379891619086266
Why do you think we find solace in the simplicity of a cup of tea?,0.01913442276418209,0.04043726995587349,0.0022383269388228655,0.07853592187166214,0.815314531326294,0.02312096208333969,0.02121862582862377
What's your personal recipe for turning a bad day into a better one?,0.02018600143492222,0.007848100736737251,0.010395502671599388,0.013646809384226799,0.8761265873908997,0.007502424530684948,0.06429453194141388
Have you ever experienced a moment when nature felt like a sanctuary?,0.005132357124239206,0.015329617075622082,0.15124757587909698,0.42687374353408813,0.30251437425613403,0.011939536780118942,0.0869627371430397
What's your favorite way to support friends going through challenging times?,0.02307007648050785,0.008557549677789211,0.007585051003843546,0.07167816907167435,0.7786924242973328,0.004813807550817728,0.10560289770364761
Isn't it amazing how a genuine apology can mend relationships?,0.0061819362454116344,0.005958622321486473,0.002351440954953432,0.0032578071113675833,0.019494913518428802,0.0026269331574440002,0.9601283669471741
Why do you think we sometimes hesitate to acknowledge our own resilience?,0.0032838289625942707,0.002119993092492223,0.9490465521812439,0.0014473486226052046,0.03074863739311695,0.002714271889999509,0.01063940953463316
What's your go-to method for turning fear into fuel for growth?,0.011345748789608479,0.003232788760215044,0.8975307941436768,0.003116183914244175,0.06830580532550812,0.002730035223066807,0.013738605193793774
Ever had a day when you felt like a character in your favorite book or movie?,0.013436601497232914,0.04171936213970184,0.014807275496423244,0.16923758387565613,0.439351886510849,0.003887416794896126,0.3175598680973053
Life's a journey; what's one destination you're excited to reach?,0.009396827779710293,0.00223692343570292,0.005149594508111477,0.07229888439178467,0.6585448980331421,0.010732999071478844,0.2416398674249649
What's your favorite way to practice mindfulness in the midst of chaos?,0.028170479461550713,0.013386023230850697,0.026190247386693954,0.019457435235381126,0.8634725213050842,0.0058631738647818565,0.043460048735141754
Why is it that we often remember the smell of a favorite place more than its visuals?,0.017071984708309174,0.21717561781406403,0.007442448753863573,0.00614098971709609,0.604059636592865,0.004377610981464386,0.1437317281961441
What's your personal anthem that makes you feel unstoppable?,0.017751147970557213,0.007311658468097448,0.0657423660159111,0.23625986278057098,0.29532143473625183,0.004573614802211523,0.3730399012565613
Have you ever had a moment when a song felt like it was written just for you?,0.017757272347807884,0.02419678494334221,0.013268178328871727,0.018137969076633453,0.40816858410835266,0.0036537405103445053,0.514817476272583
What's your favorite way to recharge when you're feeling emotionally drained?,0.003236579243093729,0.003078966401517391,0.0015793561469763517,0.00110228534322232,0.01279388926923275,0.9742411375045776,0.003967811353504658
Life's a dance; what's your signature move that expresses your joy?,0.0051349010318517685,0.001810210756957531,0.0006096621509641409,0.8751500248908997,0.07834894955158234,0.005222618114203215,0.0337236151099205
"Why do you think we find comfort in routines, even when adventure calls?",0.010967310518026352,0.011248103342950344,0.007208447903394699,0.005150063894689083,0.9038945436477661,0.004470882471650839,0.05706067383289337
What's your favorite way to celebrate the uniqueness of those around you?,0.026386979967355728,0.014065447263419628,0.00364226964302361,0.09871707856655121,0.7362560629844666,0.004250140395015478,0.11668209731578827
Ever notice how a good book can be a companion during both highs and lows?,0.008524652570486069,0.004827875178307295,0.0043108295649290085,0.017834385856986046,0.1935066282749176,0.005946784280240536,0.7650488018989563
What's your go-to method for maintaining a positive mindset during challenges?,0.013729906640946865,0.005278320517390966,0.009177164174616337,0.005075780209153891,0.9057462811470032,0.0027207727544009686,0.05827167630195618
Isn't it incredible how a shared experience can create an unspoken bond?,0.009067777544260025,0.006489425431936979,0.005550165195018053,0.006564625073224306,0.029675394296646118,0.0018188331741839647,0.9408338069915771
