dialogue,anger,disgust,fear,joy,neutral,sadness,surprise
Why do we often find inspiration in the most unexpected places?,0.00548107735812664,0.0011655123671516776,0.00582025246694684,0.008633321151137352,0.05081692710518837,0.0017897514626383781,0.926293134689331
Imagine if we could bottle laughter. It would be the most precious elixir.,0.016648778691887856,0.010567751713097095,0.0024296720512211323,0.22296220064163208,0.7082553505897522,0.004887844435870647,0.03424842283129692
What's your secret talent that not many people know about?,0.017343955114483833,0.010444911196827888,0.008072379045188427,0.005286733154207468,0.5482487082481384,0.003940995782613754,0.40666231513023376
Ever have a day when your playlist seems to perfectly match your mood?,0.012053653597831726,0.007040565833449364,0.005185835994780064,0.01273377612233162,0.7964642643928528,0.0070705292746424675,0.15945135056972504
Isn't it incredible how a single act of kindness can create a ripple effect?,0.01252745557576418,0.009180215187370777,0.004900163970887661,0.007237778045237064,0.03991130739450455,0.0017217951826751232,0.9245213270187378
"If you could have any animal as a sidekick, which would you choose?",0.015294326469302177,0.01627921126782894,0.0035525390412658453,0.005310820881277323,0.9274846315383911,0.0032613661605864763,0.028817124664783478
"Have you ever had a ""lightbulb"" moment that changed your perspective completely?",0.014730219729244709,0.006487131118774414,0.021029211580753326,0.006495321169495583,0.1106480211019516,0.00408427556976676,0.8365257978439331
Life's too short to skip dessert. What's your guilty pleasure treat?,0.007025592960417271,0.004074994940310717,0.0026760734617710114,0.09570949524641037,0.7462126612663269,0.033050309866666794,0.11125081032514572
"Do you believe in fate, or do you think we create our own destiny?",0.04774396866559982,0.027125010266900063,0.031142354011535645,0.0039464859291911125,0.8414908051490784,0.009808831848204136,0.03874249383807182
Why is it that a good laugh can instantly lift your spirits?,0.01434093527495861,0.004881046712398529,0.0030768802389502525,0.5514344573020935,0.29796499013900757,0.0035994527861475945,0.12470227479934692
What's the most courageous thing you've ever done?,0.01866692490875721,0.007543547544628382,0.03161398693919182,0.029991839081048965,0.3469586968421936,0.0016479936894029379,0.5635770559310913
Isn't it remarkable how nature has the power to heal and rejuvenate?,0.005068129859864712,0.004616893827915192,0.0020531730260699987,0.002214341890066862,0.04036353901028633,0.00172265968285501,0.9439612627029419
Have you ever had a day when everything seemed to fall into place?,0.01252210047096014,0.006253823637962341,0.014251639135181904,0.01362451259046793,0.5612538456916809,0.008566517382860184,0.383527547121048
"Life's a journey, not a destination. What's your next adventure?",0.011651145294308662,0.005474516656249762,0.019911836832761765,0.003576940158382058,0.9134547114372253,0.006481624208390713,0.039449311792850494
"If you could time travel, would you go to the past or the future?",0.012966860085725784,0.015552546828985214,0.00817764364182949,0.002002102555707097,0.9223899245262146,0.004792861174792051,0.03411799296736717
Isn't it strange how a single scent can trigger a flood of memories?,0.03725295886397362,0.2324390560388565,0.10805664211511612,0.003368142293766141,0.1408933401107788,0.005216875579208136,0.4727729856967926
What's your favorite way to practice self-care?,0.025203237310051918,0.013982988893985748,0.005675232969224453,0.044257838279008865,0.7980191111564636,0.004843450617045164,0.1080181747674942
Ever had a serendipitous encounter that changed your life?,0.004144225735217333,0.002885083667933941,0.04257962852716446,0.03240553289651871,0.043235789984464645,0.004971006419509649,0.8697787523269653
Why do you think we're drawn to certain places as if we have a connection to them?,0.03784110024571419,0.014363697730004787,0.006868748459964991,0.002930584829300642,0.37335124611854553,0.0032755981665104628,0.561369001865387
What's the most valuable lesson you've learned from a failure?,0.020785612985491753,0.01017807424068451,0.006837919820100069,0.01066215243190527,0.7996858954429626,0.003501368686556816,0.14834898710250854
Have you ever had a moment when you felt completely in sync with the universe?,0.011054749600589275,0.013159671798348427,0.030520042404532433,0.02560710348188877,0.37516188621520996,0.004713552072644234,0.5397830009460449
Life's full of surprises. What's something unexpected that brought you joy recently?,0.0039621987380087376,0.0006540340837091208,0.0022588891442865133,0.29890739917755127,0.03425461798906326,0.008249649778008461,0.6517132520675659
Why is it that we often remember the smallest details about the happiest moments?,0.01339195016771555,0.008719826117157936,0.0012453349772840738,0.05395355820655823,0.6224316358566284,0.006279206369072199,0.2939785122871399
What's your personal mantra that keeps you going on tough days?,0.019008662551641464,0.008106572553515434,0.028817635029554367,0.0047333696857094765,0.905340313911438,0.006568353157490492,0.02742513082921505
Have you ever had a moment when you felt truly alive and present?,0.002054062206298113,0.010416040197014809,0.026118367910385132,0.5209267139434814,0.25802603363990784,0.08482179045677185,0.09763702750205994
"If you could have any superpower, what would it be and why?",0.05682186037302017,0.010679134167730808,0.020047858357429504,0.004388364497572184,0.7159953117370605,0.0042134360410273075,0.18785405158996582
Isn't it fascinating how a simple conversation can change the course of your day?,0.008894871920347214,0.008302394300699234,0.0056800227612257,0.03140896558761597,0.16938655078411102,0.003058347385376692,0.7732688188552856
What's your favorite memory from a childhood summer?,0.015964757651090622,0.009041507728397846,0.005228979513049126,0.03886851295828819,0.7516149878501892,0.0036620900500565767,0.17561912536621094
Life's a series of choices. What's one decision you're grateful you made?,0.013920815661549568,0.005441159941256046,0.0016617650398984551,0.04633089900016785,0.7912784814834595,0.01892869733273983,0.1224382221698761
Why is it that we often find strength in the most challenging situations?,0.017487702891230583,0.008877046406269073,0.006104803178459406,0.0036702302750200033,0.6305839419364929,0.0033164960332214832,0.32995977997779846
"Have you ever experienced a ""Eureka!"" moment that solved a long-standing problem?",0.011045679450035095,0.003834553761407733,0.15368852019309998,0.03559281304478645,0.050983261317014694,0.002737879753112793,0.7421173453330994
What's your favorite way to express creativity?,0.02535182796418667,0.012464810162782669,0.00576823903247714,0.043112821877002716,0.6806724071502686,0.004247450269758701,0.22838236391544342
Isn't it incredible how a good friend can turn a mundane day into an adventure?,0.009332901798188686,0.00481669045984745,0.00621512345969677,0.010972185991704464,0.02217642404139042,0.0015513666439801455,0.9449352622032166
What's the most beautiful place you've ever visited?,0.004674642346799374,0.0033875801600515842,0.006069437135010958,0.1831481009721756,0.0648781806230545,0.0033952423837035894,0.7344467639923096
Have you ever had a day when you felt like you could conquer the world?,0.014141610823571682,0.0059639522805809975,0.01511811837553978,0.6109481453895569,0.12879285216331482,0.00360365048982203,0.22143162786960602
Life's too short for regrets. What's something you're glad you didn't postpone?,0.005623426754027605,0.007252144627273083,0.004165419843047857,0.1300327181816101,0.2309740036725998,0.580647885799408,0.041304394602775574
Why is it that a heartfelt compliment can boost your confidence for days?,0.030016975477337837,0.006286519579589367,0.0055771698243916035,0.08098115772008896,0.5149320363998413,0.0031393575482070446,0.35906681418418884
What's the most awe-inspiring piece of art you've ever encountered?,0.005418320652097464,0.0027992126997560263,0.3435039818286896,0.035950273275375366,0.026747530326247215,0.0019510816782712936,0.5836295485496521
Have you ever felt a connection to a song as if it was written just for you?,0.01100974716246128,0.03488181158900261,0.01743948645889759,0.014161731116473675,0.5614219903945923,0.005220382008701563,0.35586491227149963
Life's like a book with chapters. What chapter are you currently writing?,0.010061624459922314,0.010058055631816387,0.007171679753810167,0.004116597585380077,0.8574500679969788,0.0088930269703269,0.10224902629852295
What's your favorite quote or mantra that inspires you?,0.02931750938296318,0.007787559647113085,0.005880217533558607,0.051649563014507294,0.6928163766860962,0.002814027015119791,0.20973482728004456
Isn't it amazing how a random act of kindness can create a chain reaction?,0.00914073921740055,0.005188413430005312,0.002430727705359459,0.006790637504309416,0.02025902457535267,0.0013474659062922,0.9548429846763611
What's your favorite way to recharge when you're feeling drained?,0.00956603791564703,0.01004334632307291,0.004103174898773432,0.0019300361163914204,0.04787421226501465,0.9151690602302551,0.011314102448523045
Have you ever had a day when you felt like you were living in a dream?,0.009304655715823174,0.0053876591846346855,0.14498482644557953,0.009096414782106876,0.12125799059867859,0.006815255619585514,0.7031531929969788
Why do you think certain scents evoke strong emotions and memories?,0.019909290596842766,0.01922333799302578,0.010864486917853355,0.003035707166418433,0.8277018666267395,0.002783206757158041,0.11648216098546982
"Life's an adventure; sometimes, you need to embrace the detours.",0.00402847258374095,0.017467664554715157,0.009790990501642227,0.04119689390063286,0.885571300983429,0.033766839653253555,0.008177777752280235
What's the most courageous conversation you've ever had?,0.011261913925409317,0.006052467040717602,0.0298465546220541,0.029788121581077576,0.4156968295574188,0.0015531025128439069,0.5058009624481201
Have you ever had a day when you felt like you were in a movie montage?,0.012429132126271725,0.04659572243690491,0.05444027855992317,0.019732825458049774,0.4632538855075836,0.0182506013661623,0.38529759645462036
Isn't it fascinating how laughter can connect people across cultures and languages?,0.006664596032351255,0.007538843899965286,0.0016758794663473964,0.7315394282341003,0.12387359887361526,0.004715775605291128,0.12399192899465561
"Life's a dance; sometimes, you lead, and sometimes, you follow.",0.014167528599500656,0.027367347851395607,0.004939533304423094,0.004913740791380405,0.9351216554641724,0.006398482713848352,0.007091757841408253
Why do you think we find comfort in revisiting familiar places and routines?,0.006225286517292261,0.011669890955090523,0.008485538884997368,0.023356476798653603,0.9156895279884338,0.006611214019358158,0.02796212211251259
What's your favorite childhood game that you'd still play today?,0.017768405377864838,0.009625676088035107,0.0029083965346217155,0.06737020611763,0.6770952939987183,0.0052885557524859905,0.21994344890117645
Have you ever experienced a moment of pure serendipity?,0.003650918137282133,0.001985100330784917,0.02152474783360958,0.023138100281357765,0.03748493641614914,0.0037500900216400623,0.908466100692749
Isn't it strange how a single sentence can change your entire perspective?,0.013775925152003765,0.04799218103289604,0.01818913221359253,0.002356561366468668,0.04959098994731903,0.001804653205908835,0.8662905097007751
What's the most heartwarming act of kindness you've witnessed?,0.008048591203987598,0.007313614711165428,0.004395938478410244,0.27221494913101196,0.31420448422431946,0.002002307679504156,0.39182016253471375
Life's too short to hold onto grudges. What's something you're ready to let go of?,0.12581278383731842,0.05188143998384476,0.006236707326024771,0.00401890417560935,0.7827893495559692,0.021220840513706207,0.008039978332817554
Why is it that we often find inspiration in the silence between words?,0.019638080149888992,0.021556634455919266,0.019040826708078384,0.003154673147946596,0.5170376300811768,0.009052855893969536,0.4105193018913269
What's your go-to affirmation that boosts your confidence?,0.01944662444293499,0.00721795903518796,0.024773020297288895,0.027951806783676147,0.7265792489051819,0.0030007087625563145,0.19103065133094788
Do you ever feel like the universe conspires to put the right people in your path?,0.018041236326098442,0.03648868575692177,0.009194494225084782,0.051020897924900055,0.8569713234901428,0.006067420355975628,0.02221585251390934
"Life's a puzzle; sometimes, the pieces fall into place when you least expect it.",0.008288648910820484,0.0022869755048304796,0.0029602209106087685,0.007389659993350506,0.8861767649650574,0.006248767487704754,0.08664900809526443
What's the most adventurous thing you've tried lately?,0.007267621345818043,0.006180665921419859,0.00695671746507287,0.015490923076868057,0.7856643795967102,0.002918931655585766,0.17552073299884796
Ever notice how a good playlist can turn a mundane task into a dance party?,0.012921619229018688,0.005956877022981644,0.0024674865417182446,0.012515055015683174,0.06329162418842316,0.0032415452878922224,0.8996057510375977
Why do we often downplay our achievements when we should be celebrating them?,0.09446321427822113,0.05669500678777695,0.0040847607888281345,0.005561125930398703,0.7782416939735413,0.00887630321085453,0.052077919244766235
Isn't it fascinating how a simple act of gratitude can shift your entire perspective?,0.010173474438488483,0.007318540476262569,0.0034810020588338375,0.030492808669805527,0.18432724475860596,0.0026117381639778614,0.7615951895713806
Life's too short for a boring wardrobe. Let's embrace our unique styles!,0.01686224527657032,0.01107095554471016,0.0021932381205260754,0.0983489602804184,0.22347816824913025,0.6335139870643616,0.014532379806041718
What's your favorite way to practice mindfulness in a hectic world?,0.02336859703063965,0.009356790222227573,0.00944374781101942,0.015722312033176422,0.8745629191398621,0.004693933762609959,0.06285172700881958
Have you ever had a moment when a stranger's kindness restored your faith in humanity?,0.014825801365077496,0.09651690721511841,0.04345542937517166,0.1749706119298935,0.33021554350852966,0.0042166439816355705,0.33579903841018677
Why is it that we remember the lyrics to our favorite songs but struggle with other details?,0.03243135288357735,0.04145531728863716,0.03306267037987709,0.001793030183762312,0.7721448540687561,0.06218846142292023,0.05692422762513161
Do you ever wonder if parallel universes exist where different versions of our lives play out?,0.010906708426773548,0.008349195122718811,0.006467025727033615,0.002744079567492008,0.0264345183968544,0.0024896133691072464,0.9426088333129883
Life's like a book; each chapter teaches us something new. What's your current lesson?,0.010847746394574642,0.007419663015753031,0.005955149885267019,0.004147769417613745,0.8677005767822266,0.002836073050275445,0.10109306871891022
"What's your happy place, real or imaginary, that instantly lifts your spirits?",0.0075657847337424755,0.0016405718633905053,0.0025939070619642735,0.6410713195800781,0.11652012169361115,0.0057059102691709995,0.22490236163139343
Ever had a day when you felt like you had a personal cheering squad in the universe?,0.007155150640755892,0.009981591254472733,0.0022449158132076263,0.7559829354286194,0.1635521501302719,0.00350695732049644,0.057576216757297516
Why is it that we find solace in the sound of rain tapping on the window?,0.01085744146257639,0.07397111505270004,0.007085026707500219,0.12779085338115692,0.6360827684402466,0.118475042283535,0.02573779597878456
What's your favorite way to spread positivity in the world?,0.027829855680465698,0.015645846724510193,0.004910069052129984,0.09112995862960815,0.6971442103385925,0.005432129837572575,0.15790796279907227
Isn't it incredible how a simple cup of tea can turn a bad day around?,0.014234115369617939,0.008713750168681145,0.007389419712126255,0.00509096123278141,0.028319131582975388,0.0021335051860660315,0.9341191053390503
Life's a canvas waiting to be painted with the colors of our experiences. What's your palette?,0.007698575034737587,0.014333318918943405,0.008383256383240223,0.002669244073331356,0.9098993539810181,0.006860657129436731,0.050155553966760635
Do you ever feel like your dreams are trying to tell you something important?,0.037124939262866974,0.01911225914955139,0.04839750751852989,0.04397384822368622,0.6536418795585632,0.014827659353613853,0.18292182683944702
"Why do we often underestimate the impact of small, consistent actions?",0.038866836577653885,0.014159874059259892,0.011275834403932095,0.0021071217488497496,0.6651968955993652,0.006431729067116976,0.2619617283344269
"Have you ever met someone and felt an instant connection, like kindred spirits?",0.005945337470620871,0.018818089738488197,0.02665168046951294,0.36185985803604126,0.28441837430000305,0.0041982741095125675,0.2981083393096924
What's the most courageous decision you've made that changed your life?,0.016118893399834633,0.006722485646605492,0.08192773908376694,0.057024840265512466,0.45395785570144653,0.0025033545680344105,0.3817448318004608
Ever notice how the smell of fresh-baked cookies can transport you back to childhood?,0.01147534605115652,0.22255228459835052,0.005093681160360575,0.034394800662994385,0.6434710025787354,0.006498101633042097,0.07651478052139282
Life's a journey; let's appreciate the detours and unexpected adventures.,0.005779920611530542,0.0033056314568966627,0.0007475194870494306,0.6769623160362244,0.24650727212429047,0.007251754868775606,0.059445638209581375
What's your favorite way to unwind and disconnect from the digital world?,0.005777649115771055,0.008316323161125183,0.005263263825327158,0.046977195888757706,0.8701123595237732,0.03035162016749382,0.03320161998271942
Why is it that we remember the laughter shared with friends more than the jokes themselves?,0.022867197170853615,0.015915589407086372,0.0024210219271481037,0.03178275749087334,0.4751926362514496,0.0031005116179585457,0.448720246553421
Do you ever feel like the stars align when you're on the right path?,0.01072079036384821,0.006829028017818928,0.008279689587652683,0.09363465011119843,0.854141116142273,0.005404103547334671,0.020990613847970963
What's your personal anthem that pumps you up when you need motivation?,0.012983362190425396,0.00435279868543148,0.0062940409407019615,0.010503989644348621,0.8929426074028015,0.006021993234753609,0.06690123677253723
Isn't it amazing how nature has the power to heal and inspire?,0.006988633889704943,0.004871581215411425,0.0026714052073657513,0.004679778590798378,0.02107257768511772,0.0017164082964882255,0.9579996466636658
Why do you think we remember the emotions a song evokes more than the lyrics?,0.022441590204834938,0.01590585522353649,0.004870354197919369,0.0023342955391854048,0.6388286352157593,0.004236023873090744,0.31138327717781067
Life's a series of choices; what's one decision you're proud of making?,0.013584805652499199,0.011754045262932777,0.002765849232673645,0.010074831545352936,0.9186655282974243,0.003067271551117301,0.04008762910962105
What's your favorite way to embrace imperfections and find beauty in them?,0.02291153557598591,0.034569162875413895,0.006449092645198107,0.09741530567407608,0.7682982087135315,0.008632813580334187,0.06172383949160576
Ever had a day when you felt like you were living in a perfectly written script?,0.018438752740621567,0.02780001424252987,0.0399833507835865,0.07342445850372314,0.4359595477581024,0.004357753787189722,0.4000360667705536
"Why is it that we often find comfort in the familiar, even when change is exciting?",0.008936689235270023,0.013910513371229172,0.0035111396573483944,0.05249624699354172,0.8630684018135071,0.005883537698537111,0.052193522453308105
Do you ever feel like you're on the brink of a breakthrough but need that final push?,0.009935775771737099,0.007684310898184776,0.7736691832542419,0.005850881338119507,0.14898881316184998,0.013269094750285149,0.040601946413517
Life's too short for regrets; what's something you're excited to pursue?,0.0037826918996870518,0.007792605087161064,0.008072229102253914,0.004293572623282671,0.10951101034879684,0.849898099899292,0.016649780794978142
What's your favorite self-care ritual that brings you peace and joy?,0.012758134864270687,0.008080661296844482,0.0023685875348746777,0.2750717103481293,0.6483536958694458,0.005023379810154438,0.048343855887651443
Isn't it funny how a good book can transport you to another world within pages?,0.03608223795890808,0.03390497714281082,0.0068763322196900845,0.12675508856773376,0.04095953330397606,0.010214227251708508,0.7452076077461243
Why is it that we often give advice to others that we struggle to follow ourselves?,0.027491658926010132,0.04560467228293419,0.02434539794921875,0.001615976681932807,0.8199832439422607,0.03480267897248268,0.0461563766002655
Ever had a day when you felt like your energy aligned with the rhythm of the universe?,0.011874455958604813,0.010283689945936203,0.011322788894176483,0.07265844941139221,0.6650493144989014,0.003887534374371171,0.22492383420467377
What's your favorite childhood memory that still makes you smile today?,0.006739252246916294,0.00431481609120965,0.001106276293285191,0.7398014664649963,0.1875249594449997,0.003051101928576827,0.057462193071842194
"Life's like a garden; sometimes, you need to prune to encourage new growth.",0.011309746652841568,0.016393210738897324,0.0033966084010899067,0.008018801920115948,0.9337276220321655,0.014710021205246449,0.01244399044662714
Why do we find comfort in the silence shared with someone who understands us?,0.007751265075057745,0.038968224078416824,0.012906731106340885,0.008217638358473778,0.8668026328086853,0.05233034864068031,0.013023147359490395
What's the most unexpected source of inspiration you've encountered lately?,0.0038509201258420944,0.0011245915666222572,0.006686887238174677,0.02948635071516037,0.043495435267686844,0.0018349613528698683,0.913520872592926
Have you ever had a conversation that changed your perspective on a long-held belief?,0.013020351529121399,0.02218647301197052,0.012078436091542244,0.01419715117663145,0.5956000089645386,0.0052332207560539246,0.33768436312675476
Why do we sometimes resist asking for help when we know it's okay to do so?,0.1427072435617447,0.031844258308410645,0.14080895483493805,0.0025808745995163918,0.6405206322669983,0.021283619105815887,0.020254403352737427
"What's your favorite way to express creativity, whether it's art, writing, or another form?",0.019393611699342728,0.015356824733316898,0.003877235110849142,0.026438213884830475,0.8222649693489075,0.0034071318805217743,0.10926201939582825
Life's too short for negativity; what's something you're grateful for today?,0.010065047070384026,0.0049671996384859085,0.0011104639852419496,0.03674081340432167,0.8625491857528687,0.0175050999969244,0.06706216186285019
What's your favorite piece of advice that you've received and still carry with you?,0.027379877865314484,0.011064291000366211,0.0031069875694811344,0.056224070489406586,0.7574967741966248,0.003731750650331378,0.14099623262882233
Why is it that a good laugh with friends can make even the toughest days bearable?,0.021162789314985275,0.023270506411790848,0.008041762746870518,0.31984394788742065,0.5598121285438538,0.011438270099461079,0.05643060430884361
Do you ever feel like a small act of kindness can create a ripple effect in the world?,0.009682162664830685,0.02844562754034996,0.004510635044425726,0.5481854677200317,0.37411266565322876,0.0037214516196399927,0.03134199604392052
Life's a constant evolution; what's one aspect of yourself you're currently working on?,0.0076887356117367744,0.007737412117421627,0.00387204228900373,0.002191220410168171,0.9359788298606873,0.002794084371998906,0.039737727493047714
What's your favorite way to embrace change and adapt to new situations?,0.02415844053030014,0.014371865428984165,0.005803733132779598,0.040855057537555695,0.8105795383453369,0.004001838155090809,0.10022947192192078
Ever had a moment when you felt like you were exactly where you were meant to be?,0.012378619983792305,0.014090515673160553,0.24709637463092804,0.06519587337970734,0.15345998108386993,0.00621399562805891,0.501564621925354
"Why do we often find wisdom in the simplest things, like a child's perspective?",0.011213157325983047,0.018384598195552826,0.0022426315117627382,0.0024207765236496925,0.9233611822128296,0.0031615227926522493,0.03921609744429588
What's your favorite way to give back to your community or the world at large?,0.032114580273628235,0.01775445230305195,0.004163162782788277,0.12166719138622284,0.6814609169960022,0.00569925969466567,0.13714051246643066
Isn't it fascinating how a single word can hold so much power and meaning?,0.011432243511080742,0.0099252387881279,0.003924169577658176,0.009233670309185982,0.12935256958007812,0.0021879547275602818,0.8339441418647766
Why do we sometimes hesitate to celebrate our achievements instead of downplaying them?,0.005005860701203346,0.0034622771199792624,0.9288506507873535,0.0017230660887435079,0.045931801199913025,0.002891077194362879,0.012135309167206287
"Life's a dance; sometimes, you lead, and sometimes, you follow the rhythm of the universe.",0.010082259774208069,0.02213999815285206,0.0064688376151025295,0.006920476909726858,0.9391543865203857,0.005038953851908445,0.010195114649832249
What's your favorite way to recharge when you feel mentally and emotionally drained?,0.004352714866399765,0.004857297521084547,0.0015290111768990755,0.001331697916612029,0.017163969576358795,0.9662350416183472,0.004530317150056362
Have you ever experienced a moment of pure serendipity that left you in awe?,0.00514143006876111,0.0023194279056042433,0.5691145062446594,0.005396083928644657,0.013645175844430923,0.0017099520191550255,0.4026734530925751
