dialogue,anger,disgust,fear,joy,neutral,sadness,surprise
What's your favorite way to turn a negative thought into a positive affirmation?,0.024982942268252373,0.018627680838108063,0.003219656180590391,0.04981802776455879,0.8283272385597229,0.004013217985630035,0.07101117074489594
Life's too short to hold onto grudges; what's something you're ready to let go of?,0.22947581112384796,0.0513012669980526,0.00831983145326376,0.004240131936967373,0.6696313619613647,0.030355406925082207,0.006676163524389267
Why do you think we often remember the taste of a memorable meal more than other details?,0.009677466936409473,0.008952753618359566,0.003929019905626774,0.0033134559635072947,0.7257255911827087,0.0036219502799212933,0.24477967619895935
What's your personal mantra for finding strength in difficult moments?,0.015042057260870934,0.007992060855031013,0.07571884989738464,0.005393206141889095,0.8499152064323425,0.006931743584573269,0.039006803184747696
Have you ever experienced a moment of pure gratitude for the present?,0.025085201486945152,0.01284292433410883,0.0036784436088055372,0.19028788805007935,0.4363090991973877,0.005333230830729008,0.3264632225036621
What's your favorite way to express kindness to yourself and others?,0.023626964539289474,0.021702788770198822,0.003282386576756835,0.05136352777481079,0.835435152053833,0.0026222604792565107,0.061966899782419205
Why is it that we find joy in the simplicity of a child's laughter?,0.0031817115377634764,0.003089235397055745,0.00023126461019273847,0.9725204110145569,0.01492772251367569,0.0025128889828920364,0.003536764532327652
What's your go-to method for navigating uncertainty with grace?,0.013099457137286663,0.0047049676068127155,0.08620522916316986,0.004865783266723156,0.8638389706611633,0.004419370088726282,0.02286619320511818
Life's a series of chapters; what's one chapter you're excited to write next?,0.008941328153014183,0.002606608672067523,0.0039044376462697983,0.10923430323600769,0.6803404092788696,0.008066914975643158,0.18690599501132965
What's your favorite way to channel creativity when faced with a blank canvas?,0.025476878508925438,0.013697249814867973,0.009454979561269283,0.02099141664803028,0.8074164390563965,0.00792569387704134,0.11503733694553375
Ever had a day when a simple pleasure brought unexpected joy?,0.003695700317621231,0.0016048010438680649,0.005848833359777927,0.29414936900138855,0.06315918266773224,0.00677370373159647,0.6247684359550476
Why do you think we often remember the kindness of strangers more than other interactions?,0.018837444484233856,0.025385720655322075,0.0043083298951387405,0.002913323463872075,0.7670902013778687,0.0030778166837990284,0.17838716506958008
What's your personal recipe for turning a challenge into an opportunity?,0.013370112515985966,0.002908560913056135,0.009491106495261192,0.015899065881967545,0.855320930480957,0.0026169547345489264,0.10039316117763519
What's your favorite way to celebrate the accomplishments of others?,0.03371467813849449,0.01949957013130188,0.002661012811586261,0.09793965518474579,0.7352858185768127,0.004587866365909576,0.10631150752305984
Life's a melody; what's the soundtrack that accompanies your journey?,0.009061906486749649,0.010934867896139622,0.01083968486636877,0.007545880042016506,0.8170098662376404,0.015301486477255821,0.12930628657341003
What's your go-to method for finding peace in the midst of chaos?,0.03260662034153938,0.009132838808000088,0.07607172429561615,0.004040536005049944,0.8217909932136536,0.011168844066560268,0.045188456773757935
Have you ever had a moment when a simple realization led to a significant shift?,0.010887639597058296,0.006499496288597584,0.03513313829898834,0.014134281314909458,0.10516725480556488,0.0019063825020566583,0.8262718319892883
Why is it that we often find strength in the vulnerability of sharing our stories?,0.007333823945373297,0.009066667407751083,0.038064125925302505,0.006304637063294649,0.8657710552215576,0.004992512986063957,0.06846721470355988
What's your favorite way to embrace imperfection and find beauty in it?,0.02304748259484768,0.02982158213853836,0.006294813007116318,0.09700997918844223,0.7627475261688232,0.008005994372069836,0.07307258993387222
Isn't it amazing how a good friend can make a regular day extraordinary?,0.005810024216771126,0.00269957329146564,0.002875149017199874,0.006029913667589426,0.01321287639439106,0.001384030096232891,0.9679884314537048
What's your personal anthem that lifts your spirits during challenging times?,0.00680563785135746,0.004253403749316931,0.012440715916454792,0.14091365039348602,0.7481223940849304,0.005566019099205732,0.08189822733402252
Why do you think we find inspiration in the power of a shared vision?,0.026206862181425095,0.007728490978479385,0.006974111311137676,0.004412595648318529,0.7147011160850525,0.0032644474413245916,0.23671233654022217
What's your favorite way to express gratitude for the beauty in everyday moments?,0.03226301446557045,0.007834959775209427,0.0018939438741654158,0.14254888892173767,0.6533598899841309,0.003839589422568679,0.158259779214859
Ever notice how a well-timed hug can speak volumes without words?,0.0163873303681612,0.013968942686915398,0.004445033613592386,0.010895387269556522,0.09555990993976593,0.0049485438503324986,0.8537948727607727
Life's a dance; what's one move you've mastered that brings you joy?,0.004338059574365616,0.0021435851231217384,0.0005194511613808572,0.9200416803359985,0.056393660604953766,0.0036903463769704103,0.012873321771621704
What's your go-to method for turning a setback into a stepping stone?,0.021084876731038094,0.007963716983795166,0.023425500839948654,0.004285051021724939,0.8531270623207092,0.004658776801079512,0.08545500040054321
Why do you think we find comfort in the routine of familiar places?,0.008334181271493435,0.010672100819647312,0.006928096059709787,0.010190870612859726,0.8798428177833557,0.004392500035464764,0.07963939756155014
What's your favorite way to encourage yourself or others during difficult times?,0.01785467192530632,0.014309308491647243,0.028128275647759438,0.03878743574023247,0.8218080997467041,0.009477856568992138,0.06963439285755157
What's your personal recipe for turning a bad mood into a good one?,0.018553713336586952,0.007983718998730183,0.00836621131747961,0.013295440934598446,0.8855394721031189,0.007806488778442144,0.05845498666167259
What's your favorite way to practice self-compassion on challenging days?,0.02183338813483715,0.010895910672843456,0.004225165583193302,0.03867468237876892,0.8584158420562744,0.0048148855566978455,0.061140090227127075
Why is it that we often find inspiration in the resilience of others?,0.018978221341967583,0.007429972290992737,0.005951795261353254,0.005312446504831314,0.5811493992805481,0.00398465059697628,0.3771935701370239
Why do you think we sometimes hesitate to acknowledge the progress we've made?,0.00481873145326972,0.00330897094681859,0.927232563495636,0.001499567530117929,0.046073783189058304,0.003399220295250416,0.013667168095707893
Why do you think we often find inspiration in the simplicity of a cup of tea?,0.015991341322660446,0.008536748588085175,0.004580998327583075,0.004501719959080219,0.717016339302063,0.0028017773292958736,0.24657101929187775
What's your favorite way to unwind after a long day and recharge for tomorrow?,0.006652946583926678,0.007658645045012236,0.003057252848520875,0.059008657932281494,0.8658087253570557,0.021077869459986687,0.0367358922958374
Life's a canvas; what colors would you use to paint the emotions of your day?,0.023301193490624428,0.02348942495882511,0.021266501396894455,0.003223384963348508,0.8740245699882507,0.007805400528013706,0.04688955843448639
Ever notice how a simple act of kindness can create a chain reaction of positivity?,0.03861107677221298,0.019639985635876656,0.005031008739024401,0.04028739035129547,0.2911318838596344,0.0024396944791078568,0.6028589010238647
What's your go-to method for finding inspiration when you're feeling stuck?,0.11326728761196136,0.06993979215621948,0.08219888061285019,0.0015872446820139885,0.34240609407424927,0.34906235337257385,0.04153832420706749
Why do you think we often remember the smallest details of meaningful moments?,0.019172310829162598,0.01528836414217949,0.00532525684684515,0.001838680007494986,0.5734905004501343,0.004013283643871546,0.38087165355682373
What's your favorite way to celebrate the achievements of women who inspire you?,0.03274781256914139,0.01599092036485672,0.0033743230160325766,0.0737166553735733,0.755200207233429,0.003565656254068017,0.11540441960096359
Life's an adventure; what's one thing on your bucket list you're determined to check off?,0.007598726078867912,0.0023007073905318975,0.004792945459485054,0.029200883582234383,0.8898141384124756,0.004553226288408041,0.061739396303892136
Have you ever had a moment when a setback turned out to be a blessing in disguise?,0.018646301701664925,0.019977744668722153,0.187921941280365,0.02618706226348877,0.2889828681945801,0.023334721103310585,0.4349493980407715
"Why is it that we often find solace in the company of animals, whether pets or wildlife?",0.018359091132879257,0.14783670008182526,0.00271278596483171,0.17365482449531555,0.6201947927474976,0.024141011759638786,0.01310079637914896
What's your personal anthem that motivates you to face challenges head-on?,0.02017727866768837,0.011013942770659924,0.039497606456279755,0.01369717437773943,0.8714624643325806,0.010034858249127865,0.03411663696169853
What's your favorite way to create a positive and uplifting environment around you?,0.020369503647089005,0.012094923295080662,0.004350633360445499,0.14863641560077667,0.6999146938323975,0.004585912451148033,0.11004792898893356
Isn't it amazing how a change of perspective can turn obstacles into opportunities?,0.007358838804066181,0.005301265511661768,0.003138685831800103,0.005322498269379139,0.0162160936743021,0.0015906693879514933,0.9610719680786133
Why do you think we often underestimate the impact of a genuine compliment?,0.032185472548007965,0.014456282369792461,0.008100861683487892,0.0021901424042880535,0.47125881910324097,0.005012361332774162,0.46679607033729553
"What's your go-to method for finding joy in the small, everyday moments?",0.01585986651480198,0.0046004680916666985,0.006880750879645348,0.316576212644577,0.5686251521110535,0.012552659958600998,0.07490494847297668
Life's a journey; what's one lesson you've learned from a challenging experience?,0.007287429179996252,0.0033367702271789312,0.011536414735019207,0.031818971037864685,0.8010174036026001,0.003614302258938551,0.1413886994123459
Ever notice how a well-chosen book can transport you to a different time or place?,0.011827838607132435,0.0074050999246537685,0.0030311134178191423,0.01225124392658472,0.10687926411628723,0.0034204148687422276,0.8551849722862244
"What's your favorite way to practice gratitude, especially on challenging days?",0.021550346165895462,0.009277677163481712,0.0020081065595149994,0.02840553969144821,0.8788726329803467,0.002755328081548214,0.057130344212055206
Why do you think we find comfort in the wisdom shared by women who came before us?,0.008754328824579716,0.017166979610919952,0.00517444871366024,0.00926370918750763,0.9175928235054016,0.0054498594254255295,0.03659794479608536
What's your personal recipe for a perfect self-care day that rejuvenates your soul?,0.014457314275205135,0.0032719317823648453,0.008363369852304459,0.019303612411022186,0.8369355201721191,0.005531462375074625,0.11213672906160355
Have you ever had a conversation that left you feeling empowered and inspired?,0.004258409142494202,0.006335136946290731,0.0037496427539736032,0.9231311082839966,0.04689132794737816,0.0015876766992732882,0.014046834781765938
What's your go-to method for embracing change and adapting to new circumstances?,0.01742256060242653,0.006210483144968748,0.017174141481518745,0.0036893754731863737,0.8892984986305237,0.0038079372607171535,0.06239691749215126
Life's like a symphony; what's the soundtrack that represents your current chapter?,0.007237749639898539,0.012642395682632923,0.007513150572776794,0.011942282319068909,0.7716925144195557,0.01237271074205637,0.1765991598367691
Why is it that we often remember the feelings associated with certain songs more than the lyrics?,0.018139738589525223,0.026919517666101456,0.006779850460588932,0.0018646722892299294,0.6871044635772705,0.005943807307630777,0.2532479465007782
"What's your favorite way to express your creativity, whether through art, writing, or another medium?",0.02086075022816658,0.014275451190769672,0.005156605504453182,0.03530029207468033,0.7944054007530212,0.004744251258671284,0.12525734305381775
"What's a piece of advice you'd give to your younger self, knowing what you know now?",0.041213639080524445,0.03447062894701958,0.009040623903274536,0.008115045726299286,0.3244633078575134,0.007981381379067898,0.5747153759002686
Ever had a day when a random act of kindness from a stranger made a lasting impact?,0.008651696145534515,0.012726838700473309,0.006479480769485235,0.0587657205760479,0.5562299489974976,0.002691573929041624,0.35445472598075867
Why do you think we find inspiration in the stories of women who break barriers?,0.018988776952028275,0.007192614488303661,0.009325672872364521,0.006603763438761234,0.7554030418395996,0.003179355291649699,0.19930674135684967
What's your go-to method for cultivating a positive mindset in challenging situations?,0.015780769288539886,0.005792692303657532,0.011099916882812977,0.006328101735562086,0.8956402540206909,0.0026175878010690212,0.06274062395095825
What's your favorite way to connect with and support other women in your community?,0.02461884170770645,0.02122766710817814,0.006063441280275583,0.11371218413114548,0.7168695330619812,0.005870502907782793,0.11163788288831711
Life's an ever-evolving story; what's the plot twist you're excited to experience next?,0.011982208117842674,0.003022483317181468,0.013474560342729092,0.06676018238067627,0.7414780259132385,0.003587982151657343,0.15969452261924744
What's your personal mantra for staying resilient and bouncing back from setbacks?,0.016318323090672493,0.004542476963251829,0.02864411659538746,0.0068247090093791485,0.8953104019165039,0.004260373301804066,0.0440995991230011
Why do you think we often find comfort in the routine of our favorite self-care rituals?,0.007572616916149855,0.0072797928005456924,0.004164613783359528,0.010522433556616306,0.8985611796379089,0.004954076837748289,0.06694522500038147
What's your go-to method for turning a moment of self-doubt into an opportunity for growth?,0.013815518468618393,0.009034617803990841,0.20228134095668793,0.00797134917229414,0.6945355534553528,0.007248640060424805,0.06511301547288895
Have you ever experienced a moment when a book or movie taught you a valuable life lesson?,0.013564901426434517,0.04388094320893288,0.06120043247938156,0.322079598903656,0.1720859706401825,0.0045519121922552586,0.38263630867004395
What's your favorite way to celebrate the diversity of experiences and perspectives?,0.025712598115205765,0.01237984374165535,0.003735282924026251,0.09955516457557678,0.7141504883766174,0.003999681677669287,0.14046698808670044
Why is it that we often remember the laughter shared with friends more than the words spoken?,0.014846140518784523,0.010085547342896461,0.002559450687840581,0.017298007383942604,0.5394867658615112,0.003217474091798067,0.4125066101551056
What's your go-to method for finding balance in a world that sometimes feels overwhelming?,0.007351649925112724,0.009131114929914474,0.2486007958650589,0.001714183366857469,0.01911323331296444,0.007155780680477619,0.7069332003593445
What's your personal anthem for embracing your authentic self and embracing your uniqueness?,0.011626364663243294,0.006274804472923279,0.017618808895349503,0.013126797042787075,0.909649670124054,0.005508980248123407,0.0361945703625679
Life's too short for regrets; what's something you're excited to pursue without hesitation?,0.007418269291520119,0.004270395264029503,0.9195978045463562,0.001988003496080637,0.052775610238313675,0.009123383089900017,0.0048265908844769
Ever notice how a simple walk in nature can clear your mind and lift your spirits?,0.012019247747957706,0.011169164441525936,0.00959536898881197,0.18870384991168976,0.5276580452919006,0.0068689328618347645,0.24398544430732727
Why do you think we find strength in the support and camaraderie of other women?,0.022748155519366264,0.020724834874272346,0.002807685174047947,0.012020104564726353,0.8407518863677979,0.003206757130101323,0.09774062037467957
What's your favorite way to express gratitude for the mentors who have guided you?,0.04029364511370659,0.012065681628882885,0.0018240419449284673,0.21154256165027618,0.5437114834785461,0.007988713681697845,0.18257392942905426
What's your go-to method for turning a challenging day into a day of triumph?,0.016118064522743225,0.0030032650101929903,0.010878406465053558,0.0188542902469635,0.8070311546325684,0.002887294627726078,0.14122755825519562
Life's a dance; what's your signature move that reflects your inner joy?,0.008899882435798645,0.002767140045762062,0.001868672901764512,0.5063372850418091,0.37012985348701477,0.008320811204612255,0.1016763299703598
What's your personal recipe for turning a day around when things aren't going as planned?,0.02639472857117653,0.017565185204148293,0.017649207264184952,0.003341203322634101,0.7814183235168457,0.05219850689172745,0.10143284499645233
Why do you think we often find inspiration in the resilience of everyday women?,0.016506724059581757,0.006600848864763975,0.009011627174913883,0.0028592825401574373,0.78312748670578,0.0031406565103679895,0.17875340580940247
What's your favorite way to infuse positivity into your daily interactions?,0.02350524067878723,0.012755435891449451,0.0034129132982343435,0.04289890453219414,0.8131454586982727,0.0039425380527973175,0.10033951699733734
Have you ever experienced a moment when a simple gesture of kindness made a big difference?,0.01472074631601572,0.023939253762364388,0.027628282085061073,0.18959125876426697,0.22969529032707214,0.0029433309100568295,0.5114818215370178
What's your go-to method for finding clarity and calm during moments of chaos?,0.044373203068971634,0.008462927304208279,0.27857694029808044,0.004973625298589468,0.6101669669151306,0.016498861834406853,0.03694748133420944
Life's a tapestry of relationships; what's a lesson you've learned from a meaningful connection?,0.006320074666291475,0.0056203389540314674,0.006788752041757107,0.11390894651412964,0.6059373617172241,0.007224149536341429,0.2542004883289337
What's your favorite way to support and uplift the women in your life?,0.023629285395145416,0.029947370290756226,0.004997985903173685,0.11740344762802124,0.7527628540992737,0.008290351368486881,0.06296864151954651
Why is it that we often find comfort in revisiting familiar places or activities?,0.004683340433984995,0.01362526509910822,0.004788211081176996,0.24416202306747437,0.7014794945716858,0.012747174128890038,0.018514493480324745
What's your go-to method for embracing change and navigating the unknown?,0.01559161115437746,0.005736073944717646,0.04471629112958908,0.0059687355533242226,0.8534370064735413,0.00460378872230649,0.06994643062353134
What's your personal anthem that pumps you up and boosts your confidence?,0.011285735294222832,0.005703882314264774,0.012695877812802792,0.10050715506076813,0.7811678051948547,0.0033309122081846,0.08530862629413605
Ever had a day when a piece of advice or insight from a friend changed your perspective?,0.010512697510421276,0.017035238444805145,0.009070072323083878,0.011021075770258904,0.1871144026517868,0.003290624124929309,0.7619558572769165
What's your favorite way to celebrate the small victories that add up to big achievements?,0.03679046779870987,0.015383436344563961,0.0026187889743596315,0.08756357431411743,0.7537895441055298,0.004045544192194939,0.0998087152838707
Life's a journey; what's one destination you're excited to explore in the future?,0.007190176751464605,0.002194351749494672,0.004222412593662739,0.07545511424541473,0.7626678347587585,0.007756657898426056,0.14051342010498047
Why do you think we often remember the moments of joy and laughter more vividly than others?,0.01087267603725195,0.00522362207993865,0.005525487475097179,0.016110563650727272,0.7547719478607178,0.0038666489999741316,0.20362909138202667
What's your go-to method for turning a setback into a stepping stone toward success?,0.017874684184789658,0.006611542776226997,0.027370985597372055,0.00601323414593935,0.8633314371109009,0.0046590338461101055,0.07413911074399948
What's your personal mantra for staying grounded and centered in a fast-paced world?,0.018816988915205002,0.0035231132060289383,0.018832046538591385,0.0056429835967719555,0.8603255748748779,0.005323370918631554,0.08753589540719986
Have you ever had a moment when a book or movie perfectly captured your own experiences?,0.011634386144578457,0.017432548105716705,0.01095260214060545,0.059128955006599426,0.4481232166290283,0.004010562784969807,0.44871777296066284
Why do you think we find solace in the simple pleasure of a quiet moment alone?,0.009513122960925102,0.016581382602453232,0.005203183274716139,0.16278497874736786,0.6977638602256775,0.08934247493743896,0.018810952082276344
What's your favorite way to express creativity in your daily life?,0.027006683871150017,0.011365576647222042,0.006685598753392696,0.040211234241724014,0.6977721452713013,0.004612719640135765,0.21234603226184845
What's your go-to method for turning a negative thought into a positive affirmation?,0.018040738999843597,0.008792503736913204,0.007379037793725729,0.0035271269734948874,0.8861081004142761,0.003195066936314106,0.07295752316713333
Life's a dance; what's one move you've mastered that reflects your inner strength?,0.010587163269519806,0.00910097360610962,0.006171330809593201,0.006350229494273663,0.9053945541381836,0.0035884168464690447,0.058807387948036194
Why is it that we often find inspiration in the stories of women who overcome adversity?,0.014745591208338737,0.016142310574650764,0.06565481424331665,0.010569412261247635,0.42411500215530396,0.01787468232214451,0.4508981704711914
What's your favorite way to celebrate the beauty of diversity in your community?,0.02197900228202343,0.011560901999473572,0.0035617491230368614,0.13889378309249878,0.7123318314552307,0.0035442954394966364,0.1081283912062645
What's your go-to method for finding inspiration when faced with a creative block?,0.02845936268568039,0.00643589673563838,0.15502451360225677,0.009118292480707169,0.6396796107292175,0.011054211296141148,0.1502281129360199
What's your personal anthem for overcoming challenges and setbacks?,0.006877973675727844,0.004288241267204285,0.026786597445607185,0.019349943846464157,0.8867090344429016,0.013180261477828026,0.04280794411897659
Ever notice how a well-timed quote or saying can provide comfort and guidance?,0.010110612027347088,0.021509259939193726,0.0056351530365645885,0.07548955827951431,0.5869861841201782,0.00855911523103714,0.29171010851860046
Why do you think we find strength in sharing our vulnerabilities and struggles?,0.011455577798187733,0.0086884880438447,0.013234743848443031,0.0036552809178829193,0.9138389825820923,0.005570656154304743,0.043556276708841324
What's your favorite way to connect with the natural world and find inner peace?,0.01613003946840763,0.011966930702328682,0.004851742181926966,0.08384570479393005,0.8012616634368896,0.009410152211785316,0.07253372669219971
What's your go-to method for turning fear into fuel for personal and professional growth?,0.006049266550689936,0.0019653127528727055,0.9473327994346619,0.0025348879862576723,0.034071557223796844,0.0025182608515024185,0.005528004374355078
What's your personal mantra for finding joy in the present moment?,0.014672395773231983,0.005107011180371046,0.0059365881606936455,0.41154971718788147,0.49756887555122375,0.012451175600290298,0.05271419510245323
What's your favorite way to unwind and relax after a hectic day?,0.00809134729206562,0.00939507782459259,0.0036811993923038244,0.11854714155197144,0.7889294624328613,0.03955436125397682,0.03180140629410744
Life's like a puzzle; what's one piece you're currently exploring in your journey?,0.009778301231563091,0.0028602529782801867,0.01642025075852871,0.005478722974658012,0.8543875217437744,0.003913284745067358,0.10716164857149124
Ever feel like a change in perspective can open up new possibilities?,0.013798350468277931,0.01679515838623047,0.10479812324047089,0.1921413689851761,0.502558171749115,0.008750363253057003,0.16115842759609222
What's your go-to method for finding inspiration when working on a creative project?,0.020947400480508804,0.006544289644807577,0.02793714962899685,0.009769449010491371,0.7650817036628723,0.003495484124869108,0.16622444987297058
Why do we find comfort in revisiting cherished memories through photographs?,0.007304282393306494,0.018565768375992775,0.007669341750442982,0.28917643427848816,0.5750660300254822,0.09169850498437881,0.010519701056182384
What's your personal anthem for facing challenges and remaining resilient?,0.008590745739638805,0.003640597453340888,0.030850278213620186,0.011841668747365475,0.9108532667160034,0.004385200794786215,0.029838237911462784
Have you ever had a moment when a small act of kindness made a significant impact?,0.01631421223282814,0.028704943135380745,0.010589933954179287,0.14663706719875336,0.5468807220458984,0.0035440807696431875,0.247328981757164
Life's an adventure; what's one skill you're passionate about developing further?,0.006787324324250221,0.001918972353450954,0.007160326931625605,0.04586372151970863,0.7656296491622925,0.004948778543621302,0.16769126057624817
Why is it that we often remember the scent of a favorite flower from our past?,0.018150677904486656,0.08719658106565475,0.006074450444430113,0.006421749480068684,0.7845367193222046,0.003302621189504862,0.09431712329387665
