dialogue,anger,disgust,fear,joy,neutral,sadness,surprise
"Sometimes, the strongest people are the ones who love beyond all faults, cry behind closed doors, and fight battles nobody knows about.",0.032678548246622086,0.053737424314022064,0.00295356591232121,0.045396409928798676,0.8122819066047668,0.04953845590353012,0.0034137454349547625
"The best revenge is living well, and eating a really delicious meal without them.",0.38764727115631104,0.12316082417964935,0.0013033256400376558,0.02253340370953083,0.45374879240989685,0.008102063089609146,0.0035043430980294943
Adventure awaits at the intersection of 'yes' and 'why not.',0.01152819860726595,0.0038877595216035843,0.10371074080467224,0.014233254827558994,0.8328421115875244,0.00879268255084753,0.025005266070365906
Life is like a cup of tea – it's all in how you make it.,0.0051548718474805355,0.0036797053180634975,0.0012686148984357715,0.0064595406875014305,0.9683995246887207,0.00223537627607584,0.0128023074939847
I'm not arguing; I'm just explaining why I'm right.,0.11195417493581772,0.05582438036799431,0.005914491135627031,0.010266494005918503,0.8022103905677795,0.008796624839305878,0.005033442284911871
Happiness is not a destination; it's a way of life.,0.009941945783793926,0.04107341915369034,0.001600702409632504,0.04708576202392578,0.17114785313606262,0.7243567109107971,0.0047935484908521175
"If someone tells you that you can't do something, prove them wrong.",0.8652478456497192,0.036809906363487244,0.021672837436199188,0.001483584986999631,0.06515440344810486,0.00784236565232277,0.0017891599563881755
Being both soft and strong is a combination very few have mastered.,0.0036710684653371572,0.02863406017422676,0.00454128859564662,0.0035296613350510597,0.9369281530380249,0.007454242091625929,0.015241507440805435
The best ideas often come from the quietest voices.,0.0028724728617817163,0.006136105861514807,0.0020344082731753588,0.14917954802513123,0.8183000087738037,0.006909030489623547,0.014568415470421314
Don't be a woman who needs a man; be a woman a man needs.,0.09192494302988052,0.14034321904182434,0.019993958994746208,0.01298074796795845,0.6847943663597107,0.03944634646177292,0.010516379959881306
"Life isn't perfect, but your hair can be.",0.005717476364225149,0.014026185497641563,0.006906801834702492,0.05328916385769844,0.8467129468917847,0.06390229612588882,0.00944507960230112
"If you stumble, make it part of the dance.",0.0077534690499305725,0.013874171301722527,0.5071613788604736,0.0069597382098436356,0.4232042729854584,0.035565461963415146,0.00548148900270462
A smile is the best makeup any girl can wear.,0.0057487403973937035,0.016679413616657257,0.000508097349666059,0.7568806409835815,0.20424120128154755,0.00508807273581624,0.010853768326342106
You are not required to set yourself on fire to keep others warm.,0.4414556920528412,0.040266551077365875,0.02000925876200199,0.0036328118294477463,0.47523394227027893,0.014757441356778145,0.00464427936822176
"Coffee in one hand, confidence in the other.",0.021018629893660545,0.07216139137744904,0.010248581878840923,0.5333241820335388,0.3524303138256073,0.00546561274677515,0.005351297557353973
There is a shade of red for every woman.,0.0031743317376822233,0.008228672668337822,0.0009761287947185338,0.003191704396158457,0.9657163023948669,0.007178917992860079,0.01153385266661644
Your vibe attracts your tribe.,0.01607278175652027,0.08356274664402008,0.002525613410398364,0.20495598018169403,0.6697139143943787,0.010853463783860207,0.012315500527620316
Never underestimate the power of a good outfit on a bad day.,0.09120265394449234,0.04299437254667282,0.05975569412112236,0.052347611635923386,0.5553438067436218,0.05581304430961609,0.14254289865493774
"She believed she could, so she did.",0.4274339973926544,0.05864126980304718,0.007392899598926306,0.030102986842393875,0.44746482372283936,0.009723803959786892,0.01924019306898117
Behind every successful woman is a tribe of other successful women who have her back.,0.007451975718140602,0.004295730032026768,0.0014315720181912184,0.05162452906370163,0.8929604291915894,0.004127559717744589,0.03810819983482361
Life is too short to wear boring clothes.,0.007392778526991606,0.028333032503724098,0.002120892284438014,0.0033010453917086124,0.05523427575826645,0.8996568918228149,0.003961050417274237
Empowered women empower women.,0.04250567406415939,0.08694160729646683,0.004345111548900604,0.17656005918979645,0.6752189993858337,0.00630396232008934,0.00812454055994749
Confidence is silent; insecurities are loud.,0.03106526844203472,0.09013579785823822,0.02241944707930088,0.004302294459193945,0.7625349164009094,0.0864601880311966,0.003082077484577894
Own your story; it's what makes you unique.,0.021626340225338936,0.007612630259245634,0.0045879133976995945,0.02518274076282978,0.9149168133735657,0.0024299011565744877,0.023643631488084793
"Surround yourself with those who bring out the best in you, not the stress in you.",0.017932405695319176,0.04161568358540535,0.010719291865825653,0.045012474060058594,0.8701900839805603,0.00517228664830327,0.0093576954677701
Don't just exist; live with intention.,0.08286188542842865,0.015305536799132824,0.003798959543928504,0.004365165252238512,0.8862395286560059,0.004661541432142258,0.0027674969751387835
Embrace the glorious mess that you are.,0.020372424274683,0.00563193392008543,0.004332179669290781,0.7099261283874512,0.24664199352264404,0.0052606831304728985,0.00783461332321167
You are your best thing.,0.05150175094604492,0.04605036973953247,0.0023171971552073956,0.04668322950601578,0.844247579574585,0.0039761667139828205,0.0052237617783248425
Create your own sunshine.,0.022715887054800987,0.006141110323369503,0.0010997490026056767,0.08173482865095139,0.8665410876274109,0.008680173195898533,0.01308711152523756
"Darling, you are a work of art.",0.18855391442775726,0.6029086709022522,0.002666493644937873,0.006526259705424309,0.15694698691368103,0.007883981801569462,0.03451365977525711
Real queens fix each other's crowns.,0.019689157605171204,0.024951934814453125,0.0015038487035781145,0.012403842061758041,0.9153363108634949,0.013106773607432842,0.013008125126361847
Shine like the whole universe is yours.,0.01520443707704544,0.060494061559438705,0.01279710978269577,0.030748404562473297,0.8594736456871033,0.013458474539220333,0.007823790423572063
Beautiful minds inspire others.,0.009961863979697227,0.0188803318887949,0.0030618798919022083,0.7608255743980408,0.19080980122089386,0.004680705722421408,0.011779827997088432
"Life is tough, my darling, but so are you.",0.007191450335085392,0.018229827284812927,0.04843531921505928,0.024429460987448692,0.13990508019924164,0.754814863204956,0.006993996910750866
The only limit to our realization of tomorrow will be our doubts of today.,0.008506761863827705,0.012269777245819569,0.20849087834358215,0.012440614402294159,0.7267433404922485,0.020215937867760658,0.011332754045724869
The most beautiful thing a woman can wear is confidence.,0.009005052968859673,0.05860291048884392,0.00600210577249527,0.4802962839603424,0.43344831466674805,0.006621362641453743,0.0060239373706281185
"Success is not final, failure is not fatal: It is the courage to continue that counts.",0.012877309694886208,0.011172428727149963,0.04893186688423157,0.08516836911439896,0.828514814376831,0.009531768038868904,0.0038035083562135696
Beauty begins the moment you decide to be yourself.,0.013743577525019646,0.04327976331114769,0.0283905528485775,0.16312339901924133,0.7396591901779175,0.00392710929736495,0.007876463234424591
You are not a drop in the ocean; you are the entire ocean in a drop.,0.02755354903638363,0.03745933622121811,0.017008882015943527,0.0032205884344875813,0.74413001537323,0.00853598490357399,0.16209164261817932
Life is either a daring adventure or nothing at all.,0.016712531447410583,0.005652736872434616,0.21024732291698456,0.15827442705631256,0.4618425965309143,0.010764948092401028,0.13650541007518768
Success isn't about how much money you make; it's about the difference you make in people's lives.,0.02329624630510807,0.01265572290867567,0.0030466713942587376,0.04519103094935417,0.8894907832145691,0.0029744694475084543,0.02334495261311531
"Sometimes, the best way to solve a problem is to stop thinking about it.",0.04025685787200928,0.18917813897132874,0.006160094402730465,0.005170643795281649,0.7372612357139587,0.01963852345943451,0.0023345332592725754
Your value doesn't decrease based on someone's inability to see your worth.,0.055190309882164,0.045638762414455414,0.0033925471361726522,0.003296174108982086,0.8744001984596252,0.008510054089128971,0.009571898728609085
The most important relationship in your life is the one you have with yourself.,0.01590203493833542,0.03283624351024628,0.010931478813290596,0.3288145661354065,0.5568346381187439,0.04775755852460861,0.006923511158674955
Surround yourself with those who see your value and remind you of it.,0.015076445415616035,0.04928091540932655,0.012037490494549274,0.07727790623903275,0.8270229697227478,0.002652340102940798,0.01665193773806095
Life is too short to waste on hating anyone.,0.33352530002593994,0.5019843578338623,0.002754711080342531,0.003960549831390381,0.10336657613515854,0.05186443775892258,0.0025440880563110113
Every flower must grow through dirt to reach the sunshine.,0.026007527485489845,0.12241112440824509,0.0033336705528199673,0.007251300383359194,0.8181843161582947,0.017184173688292503,0.005627946462482214
The way you speak to yourself matters the most.,0.022083835676312447,0.05617151036858559,0.0059568495489656925,0.013546541333198547,0.8932600021362305,0.004814567975699902,0.0041666533797979355
Don't be a product of your circumstances; be a product of your decisions.,0.2267250418663025,0.1320628523826599,0.022459659725427628,0.004257940221577883,0.5950071811676025,0.015366113744676113,0.004121209029108286
"When life gives you lemons, make lemonade, and then sell it.",0.04823562502861023,0.02185206487774849,0.0017099888063967228,0.11724437773227692,0.798549234867096,0.004158045630902052,0.008250702172517776
Kindness is free; sprinkle it everywhere.,0.030548231676220894,0.0696176216006279,0.004365466069430113,0.026266999542713165,0.8582797050476074,0.00791193451732397,0.0030100306030362844
"Your vibe attracts your tribe, so choose wisely.",0.010827235877513885,0.023214390501379967,0.0014921707333996892,0.02738155610859394,0.9289860129356384,0.004138875287026167,0.003959862515330315
Sometimes the best response is no response.,0.045332152396440506,0.20471875369548798,0.007082182914018631,0.0022289729677140713,0.6817445158958435,0.05030151456594467,0.008591916412115097
"Be a voice, not an echo.",0.020867975428700447,0.030031831935048103,0.02046911232173443,0.0029606125317513943,0.9102681279182434,0.011274611577391624,0.004127677530050278
The best is yet to come.,0.002963956678286195,0.004666339140385389,0.0053882235661149025,0.057837773114442825,0.9132704138755798,0.006387223955243826,0.009486068971455097
Don't just dream; do.,0.06409649550914764,0.009872429072856903,0.22067709267139435,0.047073014080524445,0.5787140130996704,0.03268809616565704,0.04687885940074921
"Life is a journey that must be traveled, no matter how bad the roads and accommodations.",0.02728196047246456,0.3852407932281494,0.09654895216226578,0.0049530137330293655,0.35945889353752136,0.12276411056518555,0.0037522350903600454
Be fearless in the pursuit of what sets your soul on fire.,0.15036624670028687,0.0051836431957781315,0.75652015209198,0.008721529506146908,0.07268986850976944,0.0044898404739797115,0.002028720686212182
"Your time is now; start where you are, use what you have, do what you can.",0.26367419958114624,0.015445789322257042,0.26977798342704773,0.006191204767674208,0.42660874128341675,0.01121247373521328,0.007089598570019007
It's okay not to be okay as long as you are not giving up.,0.13817571103572845,0.22070829570293427,0.04977879300713539,0.012247874401509762,0.41310274600982666,0.16412734985351562,0.0018590757390484214
The only limits that exist are the ones you place on yourself.,0.02353650890290737,0.023192960768938065,0.003238759469240904,0.004072633106261492,0.9320612549781799,0.006460871081799269,0.007437008433043957
Your potential is endless.,0.010660779662430286,0.003035223577171564,0.006473698187619448,0.0624234601855278,0.8393862843513489,0.005996940191835165,0.07202357053756714
"Keep your head high, keep your chin up, and most importantly, keep smiling.",0.0160391703248024,0.017138147726655006,0.0009678879869170487,0.26139962673187256,0.6832379698753357,0.015393704175949097,0.005823453422635794
"Sometimes you win, sometimes you learn.",0.04794047772884369,0.02177591808140278,0.0027231108397245407,0.08278968930244446,0.8336216807365417,0.005029304418712854,0.006119854282587767
The goal is not to be better than anyone else but to be better than you used to be.,0.008056852966547012,0.015777532011270523,0.0024107194039970636,0.02100989781320095,0.938869059085846,0.0069237761199474335,0.006952094845473766
Your life does not get better by chance; it gets better by change.,0.02704913355410099,0.013208949007093906,0.007676500827074051,0.008410693146288395,0.9143043756484985,0.022712456062436104,0.0066379765048623085
Create the life you can't wait to wake up to.,0.012666666880249977,0.0037001878954470158,0.014535978436470032,0.09121805429458618,0.8415724039077759,0.009395238012075424,0.026911407709121704
Don't count the days; make the days count.,0.1307937651872635,0.030189523473381996,0.013231372460722923,0.00422128289937973,0.7891066670417786,0.01903189718723297,0.013425460085272789
Life is short; buy the shoes.,0.01544361561536789,0.00513418298214674,0.006889132782816887,0.020131593570113182,0.9331540465354919,0.014385433867573738,0.00486198253929615
The only impossible journey is the one you never begin.,0.01047468464821577,0.00881238840520382,0.16910547018051147,0.006168438121676445,0.7593331933021545,0.009745372459292412,0.036360520869493484
Your potential is like a seed; it needs nurturing to grow.,0.008371004834771156,0.013811592943966389,0.005371283274143934,0.006328985095024109,0.9485745429992676,0.0069574033841490746,0.010585196316242218
"Confidence is not ""They will like me."" Confidence is ""I'll be fine if they don't.""",0.018351713195443153,0.015400799922645092,0.019825682044029236,0.018705982714891434,0.9202831387519836,0.004363137297332287,0.0030695602763444185
A strong woman looks a challenge in the eye and gives it a wink.,0.023428820073604584,0.3659972846508026,0.0017045193817466497,0.301928848028183,0.29259544610977173,0.009366855025291443,0.004978233482688665
Your worth is not determined by others' opinions.,0.059596143662929535,0.049146417528390884,0.005810325499624014,0.011869397945702076,0.8586065173149109,0.010332196019589901,0.004638984799385071
You're never too old to set another goal or to dream a new dream.,0.004468370694667101,0.005290893837809563,0.004499215632677078,0.007379043381661177,0.9582307934761047,0.0070656947791576385,0.013066020794212818
Your attitude determines your direction.,0.07213208079338074,0.042153190821409225,0.004010010045021772,0.0039837476797401905,0.8680298328399658,0.0059758517891168594,0.0037153332959860563
The best way to predict the future is to create it.,0.007246143650263548,0.004033188801258802,0.004034230951219797,0.00635584257543087,0.9691855311393738,0.002260657027363777,0.006884289439767599
Life is short; do stuff that matters.,0.038719117641448975,0.01906374655663967,0.007316163275390863,0.03775225207209587,0.8798003792762756,0.014200442470610142,0.003147873328998685
Wake up with determination; go to bed with satisfaction.,0.11318297684192657,0.015533212572336197,0.013810861855745316,0.18927264213562012,0.6325715780258179,0.029545718804001808,0.006083076354116201
Bloom where you are planted.,0.01998399756848812,0.022942710667848587,0.004711577668786049,0.015347529202699661,0.9131969213485718,0.008617151528596878,0.015200091525912285
What you get by achieving your goals is not as important as what you become by achieving your goals.,0.06657743453979492,0.03442765772342682,0.0016566157573834062,0.01903141476213932,0.8540248870849609,0.0048971460200846195,0.019384874030947685
Be the kind of person your dog thinks you are.,0.06485769152641296,0.14258043467998505,0.005605670157819986,0.018836036324501038,0.7568016052246094,0.006057551130652428,0.005260997451841831
Don't be afraid to start over. It's a brand new opportunity to rebuild what you truly want.,0.002965858904644847,0.002478675451129675,0.9108868837356567,0.006107687950134277,0.0669737160205841,0.004061673767864704,0.006525587290525436
The best way to predict your future is to create it.,0.007937007583677769,0.004552081692963839,0.004107681103050709,0.0066248103976249695,0.9692927002906799,0.0024170621763914824,0.005068643484264612
What's the most adventurous thing you've ever done?,0.010255678556859493,0.0066670202650129795,0.011253583244979382,0.02143554389476776,0.4955543875694275,0.003148152958601713,0.4516856074333191
"Wow, that sunset is breathtaking!",0.007035514805465937,0.003497996600344777,0.012716286815702915,0.042594168335199356,0.02299201861023903,0.004314601421356201,0.9068493843078613
Can you believe it's been a year since we started this journey?,0.00897072535008192,0.003414891893044114,0.0024779243394732475,0.003153886878862977,0.0150921531021595,0.002515888074412942,0.9643745422363281
I can't wait to see where life takes us next!,0.0018178016180172563,0.0006137345335446298,0.0017826389521360397,0.9743103981018066,0.012612721882760525,0.0024195497389882803,0.006443148944526911
Why do we always underestimate the power of a good laugh?,0.03544187918305397,0.011596384458243847,0.013685176149010658,0.003059657756239176,0.6406145095825195,0.007040707394480705,0.28856170177459717
Have you ever danced in the rain just because?,0.02476825751364231,0.041352201253175735,0.015081913210451603,0.013284880667924881,0.5754274129867554,0.017759375274181366,0.31232592463493347
"There's something magical about the sound of waves crashing on the shore, don't you think?",0.023993609473109245,0.04342799633741379,0.14727024734020233,0.01838069036602974,0.0647200345993042,0.014754236675798893,0.6874532103538513
I'm on a mission to find the perfect playlist for every mood. Any recommendations?,0.005152661819010973,0.002244318835437298,0.0023416667245328426,0.032966095954179764,0.9022374749183655,0.005497275851666927,0.049560513347387314
Isn't it amazing how a simple cup of tea can soothe the soul?,0.004832236561924219,0.005978978238999844,0.003525994485244155,0.022276291623711586,0.04294857755303383,0.00714827748015523,0.9132896065711975
What's your favorite way to unwind after a long day?,0.0046431515365839005,0.00940311886370182,0.0027773240581154823,0.06108948215842247,0.8608111143112183,0.01933710090816021,0.04193868115544319
Why do we wait for Fridays to celebrate? Let's make every day a reason to rejoice!,0.006503324955701828,0.0010359125444665551,0.0005126352189108729,0.9375560879707336,0.02727135270833969,0.004368198104202747,0.02275237813591957
Can you imagine a world without music? It's like a language everyone understands.,0.021645039319992065,0.01605924218893051,0.01093850377947092,0.013650068081915379,0.1282176822423935,0.003109307959675789,0.8063801527023315
I just finished a book that changed my perspective completely. Have you read anything like that lately?,0.017216244712471962,0.029697377234697342,0.005628260318189859,0.0127901965752244,0.4977255165576935,0.005625054705888033,0.4313173294067383
Ever notice how a smile from a stranger can brighten your entire day?,0.0123976431787014,0.009968212805688381,0.0030476560350507498,0.6089234948158264,0.07871583849191666,0.003890294348821044,0.2830568552017212
"Life's too short to wear boring colors. Today, I'm embracing the vibrant hues!",0.010105723515152931,0.008344441652297974,0.0008044601418077946,0.7887459397315979,0.06889650970697403,0.11284644156694412,0.010256563313305378
What's the one piece of advice you wish you could give your younger self?,0.01016288436949253,0.01093768235296011,0.018846865743398666,0.005102291703224182,0.7894513010978699,0.019385499879717827,0.14611339569091797
Shoutout to all the strong women who've paved the way for us. Let's continue breaking those glass ceilings!,0.9243428111076355,0.023103099316358566,0.014389822259545326,0.0063911015167832375,0.01917581632733345,0.00448019802570343,0.00811692513525486
Isn't it funny how a small act of kindness can have a ripple effect on the entire day?,0.04413110390305519,0.03751770406961441,0.007111454848200083,0.14857590198516846,0.0713161826133728,0.010037575848400593,0.6813100576400757
Who needs a superhero when you have your best friend by your side?,0.02152148075401783,0.015898002311587334,0.004309808369725943,0.018643777817487717,0.7509707808494568,0.005975430831313133,0.18268072605133057
"Do you ever feel like you're on the verge of a breakthrough, and all you need is that one moment of courage?",0.011850353330373764,0.007665721233934164,0.36712878942489624,0.10414041578769684,0.4697124660015106,0.005046401172876358,0.034455861896276474
"The best stories often begin with ""Once upon a time in the middle of an ordinary life...""",0.0032584350556135178,0.009254341013729572,0.007952737621963024,0.02151094377040863,0.9337946772575378,0.002560643944889307,0.02166825719177723
Why is it that a cup of hot cocoa feels like a hug from the inside?,0.00892209354788065,0.040299512445926666,0.0019513129955157638,0.4924415647983551,0.3597847819328308,0.01009200420230627,0.08650873601436615
"Have you ever had a moment when a song played, and suddenly, you were transported back in time?",0.006353749893605709,0.0032246424816548824,0.01729045994579792,0.002930299611762166,0.021556463092565536,0.0014827597187831998,0.9471616148948669
"Let's make a pact to never lose our sense of wonder, no matter how old we get.",0.007682732306420803,0.005310711916536093,0.009296556934714317,0.009575646370649338,0.46397140622138977,0.010460744611918926,0.4937021732330322
Isn't it fascinating how different scents can evoke the most vivid memories?,0.011284719221293926,0.02947044186294079,0.009171013720333576,0.01397330965846777,0.4444875419139862,0.003938436508178711,0.4876745045185089
Who needs a magic wand when you have the power of determination and hard work?,0.01596507988870144,0.0070883771404623985,0.005406969226896763,0.004912286996841431,0.8403158783912659,0.003751997370272875,0.12255945056676865
Why is it that we tend to remember the compliments we receive years later?,0.015322845429182053,0.013544296845793724,0.0024732735473662615,0.0018617279129102826,0.7322583794593811,0.004165404476225376,0.2303740680217743
Imagine if we could see emotions as colors. What color would joy be?,0.01640736684203148,0.010223230347037315,0.0022325243335217237,0.5947020053863525,0.32533538341522217,0.015358024276793003,0.03574145585298538
"Life's like a puzzle; sometimes, you need to step back to see the bigger picture.",0.011077769100666046,0.006292852107435465,0.03297162801027298,0.0057063596323132515,0.8910126686096191,0.013782627880573273,0.03915609419345856
What's your go-to karaoke song that you'd confidently sing in front of a crowd?,0.021759839728474617,0.0049522072076797485,0.023080967366695404,0.05751393735408783,0.7434526085853577,0.0029512967448681593,0.1462891548871994
"Have you ever met someone and felt an instant connection, like you've known them forever?",0.009671528823673725,0.014031018130481243,0.0415203757584095,0.16794590651988983,0.284277081489563,0.006760236341506243,0.4757937788963318
"If you could have dinner with any historical figure, who would it be and why?",0.01903865486383438,0.019471917301416397,0.007424297276884317,0.0025532341096550226,0.88346928358078,0.0023969763424247503,0.06564565747976303
There's something magical about the first snowfall. Don't you agree?,0.020260745659470558,0.03487252816557884,0.020145023241639137,0.045242708176374435,0.17518654465675354,0.005408966913819313,0.6988834738731384
What's your favorite way to spend a lazy Sunday afternoon?,0.012103108689188957,0.0071551562286913395,0.001493793330155313,0.2554817199707031,0.6387032866477966,0.022718258202075958,0.06234470382332802
Have you ever had a dream that felt so real you woke up questioning reality?,0.010616007260978222,0.004709962755441666,0.2632317543029785,0.00737824896350503,0.03960692137479782,0.0031533543951809406,0.6713038086891174
"If you could have a conversation with your future self, what advice would you ask for?",0.019209304824471474,0.014776252210140228,0.07257699966430664,0.004567925818264484,0.8521615266799927,0.012147869914770126,0.02456017956137657
Isn't it funny how a good book can transport you to another world within seconds?,0.03521374613046646,0.02733589895069599,0.00610323203727603,0.08966795355081558,0.03753213584423065,0.008997379802167416,0.7951496839523315
What's the soundtrack of your life right now?,0.01968545839190483,0.025625497102737427,0.01845504157245159,0.011538191698491573,0.5488696098327637,0.05526875704526901,0.3205574154853821
"Life's a rollercoaster; sometimes, you just have to throw your hands in the air and enjoy the ride.",0.008650543168187141,0.007889730855822563,0.0035570727195590734,0.42087408900260925,0.5173950791358948,0.012221019715070724,0.029412491247057915
Have you ever had a moment when you felt like you were exactly where you were meant to be?,0.014409671537578106,0.0169439185410738,0.11578810960054398,0.05663810297846794,0.2803662419319153,0.0066368370316922665,0.5092171430587769
"Who would play you in a movie about your life, and what would the title be?",0.01710985228419304,0.017078766599297523,0.008625892922282219,0.010378878563642502,0.8877356052398682,0.004070311319082975,0.055000681430101395
